{
  "schema_version": "1.0",
  "id": "visual-first-cue-response",
  "title": "visual-first-cue-response",
  "revision": 1,
  "fps": "24",
  "width": 640,
  "height": 360,
  "duration_frames": 144,
  "seed": 73,
  "prompt": "Kinesmith 與 Opusmith 雙向協作驗收；不宣稱為使用者指定完整創作。",
  "scenes": [
    {
      "id": "form",
      "engine": "canvas",
      "source": "scenes/canvas.html",
      "start_frame": 0,
      "duration_frames": 72,
      "params": {
        "accent": "#65d4cf"
      }
    },
    {
      "id": "motion",
      "engine": "canvas",
      "source": "scenes/canvas.html",
      "start_frame": 72,
      "duration_frames": 72,
      "params": {
        "accent": "#ff775a"
      }
    }
  ],
  "audio": {
    "source": "music/versions/v001/audio/master.wav",
    "offset_seconds": 0
  },
  "interchange": "music-return.av.json"
}